{
  "$schema": "http://json-schema.org/draft-07/schema#",
  "$id": "https://json-schema.org/draft-07/schema#",
  "required": [
    "senderID",
    "distributionID",
    "dateTimeSent",
    "dateTimeExpires",
    "distributionStatus",
    "distributionKind",
    "descriptor",
    "content"
  ],
  "properties": {
    "senderID": {
      "type": "string"
    },
    "distributionID": {
      "type": "string"
    },
    "dateTimeSent": {
      "type": "string",
      "format": "date-time"
    },
    "dateTimeExpires": {
      "type": "string",
      "format": "date-time"
    },
    "content": {
      "$ref": "#/definitions/Content"
    },
    "descriptor": {
      "$ref": "#/definitions/Descriptor"
    },
    "distributionKind": {
      "$ref": "#/definitions/DistributionKind"
    },
    "distributionStatus": {
      "$ref": "#/definitions/DistributionStatus"
    }
  },
  "additionalProperties": false,
  "definitions": {
    "Content": {
      "type": "array",
      "items": {
        "$ref": "#/definitions/ContentObject"
      },
      "minItems": 1
    },
    "ContentObject": {
      "type": "object",
      "required": [
        "jsonContent"
      ],
      "properties": {
        "jsonContent": {
          "$ref": "#/definitions/JsonContent"
        }
      },
      "additionalProperties": false
    },
    "JsonContent": {
      "type": "object",
      "required": [
        "embeddedJsonContent"
      ],
      "properties": {
        "embeddedJsonContent": {
          "$ref": "#/definitions/EmbeddedJsonContent"
        }
      },
      "additionalProperties": false
    },
    "EmbeddedJsonContent": {
      "type": "object"
    },
    "Descriptor": {
      "type": "object",
      "properties": {
        "explicitAddress": {
          "$ref": "#/definitions/ExplicitAddress"
        },
        "language": {
          "type": "string"
        }
      },
      "additionalProperties": false,
      "required": [
        "explicitAddress",
        "language"
      ]
    },
    "DistributionKind": {
      "type": "string",
      "enum": [
        "Report",
        "Update",
        "Cancel",
        "Ack",
        "Error"
      ]
    },
    "DistributionStatus": {
      "type": "string",
      "enum": [
        "Actual",
        "Exercise"
      ]
    },
    "ExplicitAddress": {
      "type": "object",
      "properties": {
        "explicitAddressScheme": {
          "type": "string"
        },
        "explicitAddressValue": {
          "type": "string"
        }
      },
      "additionalProperties": false,
      "required": [
        "explicitAddressScheme",
        "explicitAddressValue"
      ]
    }
  }
}