{
  "distributionID": "fr.health.hub_2608323d-507d-4cbf-bf74-52007f8124ea",
  "senderID": "fr.health.hub",
  "dateTimeSent": "2022-07-25T10:04:34+01:00",
  "dateTimeExpires": "2072-07-25T10:04:34+01:00",
  "distributionStatus": "Actual",
  "distributionKind": "Report",
  "descriptor": {
    "language": "fr-FR",
    "explicitAddress": {
      "explicitAddressScheme": "hubex",
      "explicitAddressValue": "fr.health.samuA"
    }
  },
  "content": [
    {
      "jsonContent": {
        "embeddedJsonContent": {
          "message": {
            "messageId": "fr.health.samuA_2608323d-507d-4cbf-bf74-52007f8124ea",
            "sender": {
              "name": "samuA",
              "URI": "hubex:fr.health.samuA"
            },
            "sentAt": "2022-07-25T10:04:34+01:00",
            "kind": "Report",
            "status": "Actual",
            "recipient": [
              {
                "name": "samuB",
                "URI": "hubex:fr.health.samuB"
              }
            ],
            "geoPos": {
              "positionUpdate": [
                {
                  "id": "76_45101#SMUR1#",
                  "datetime": "2024-01-27T08:44:00+02:00",
                  "receptionDatetime": "2024-01-27T08:45:00+02:00",
                  "coord": [
                    {
                      "lat": 49.464944,
                      "lon": 1.097341
                    }
                  ],
                  "move": "STATIQUE",
                  "engineOn": false,
                  "status": "DISPONIBLE"
                },
                {
                  "id": "76_45102#SMUR2#",
                  "datetime": "2024-01-27T08:43:00+02:00",
                  "receptionDatetime": "2024-01-27T08:45:00+02:00",
                  "coord": [
                    {
                      "lat": 49.428421,
                      "lon": 1.086735
                    }
                  ],
                  "move": "STATIQUE",
                  "engineOn": true,
                  "status": "INDISPONIBLE",
                  "engagedStatus": "ARRIVEE_LIEU"
                },
                {
                  "id": "76_45104#SMUR4#",
                  "datetime": "2024-01-27T08:46:00+02:00",
                  "receptionDatetime": "2024-01-27T08:48:00+02:00",
                  "coord": [
                    {
                      "lat": 49.448681,
                      "lon": 1.072659
                    }
                  ],
                  "move": "MOBILE",
                  "engineOn": false,
                  "status": "INDISPONIBLE"
                }
              ]
            }
          }
        }
      }
    }
  ]
}
