{
  "distributionID": "fr.health.samuA_2608323d-507d-4cbf-bf74-52007f8124ea",
  "senderID": "fr.health.samuA",
  "dateTimeSent": "2022-07-25T10:04:34+01:00",
  "dateTimeExpires": "2072-07-25T10:04:34+01:00",
  "distributionStatus": "Actual",
  "distributionKind": "Report",
  "descriptor": {
    "language": "fr-FR",
    "explicitAddress": {
      "explicitAddressScheme": "hubex",
      "explicitAddressValue": "fr.health.samuB"
    }
  },
  "content": [
    {
      "jsonContent": {
        "embeddedJsonContent": {
          "message": {
            "CONTEXT": {
              "ID": "d350c9d2-9d76-4568-b0b7-a747ffadc949",
              "MODE": "ACTUAL",
              "MSGTYPE": "UPDATE",
              "CREATION": "2022-09-27T08:25:54+02:00",
              "LINK": [
                {
                  "ID": "samuA:CA126B445579GD4A67AV",
                  "LINK_ROLE": "ADDSTO"
                }
              ],
              "LEVEL": "OPR",
              "SECLASS": "RESTRC",
              "FREETEXT": "Contexte de grand incendie \u00e0 Nantes",
              "ORIGIN": {
                "ORG_ID": "samuA",
                "USER_ID": "samuA:crra:poste1234",
                "NAME": "Samu A"
              },
              "EXTERNAL_INFO": [
                {}
              ]
            },
            "EVENT": {
              "ID": "samuA:CA126B445579GD4A67AV",
              "NAME": "Grand incendie Nantes",
              "MAIN_EVENT_ID": "samuA:CA126B445579GD4A67AV",
              "ETYPE": {
                "CATEGORY": [
                  "FIR"
                ],
                "ACTOR": [
                  "PPL"
                ],
                "LOCTYPE": [
                  "FLAM"
                ],
                "ENV": "/CDIS/RIOT"
              },
              "SOURCE": "COMFOR",
              "SCALE": "3",
              "CERTAINTY": 95,
              "DECL_DATIME": "2022-09-27T08:24:50+02:00",
              "OCC_DATIME": "2022-09-27T08:20:50+02:00",
              "OBS_DATIME": "2022-09-27T08:26:00+02:00",
              "STATUS": "IPR",
              "RISK_ASSESMENT": "STABLE",
              "REFERENCE": [
                {
                  "ORG_ID": "samuC",
                  "OTHER_EVENT_ID": [
                    "samuC:DB326B5RC279GD4A67ZY"
                  ]
                }
              ],
              "CASUALTIES": [
                {
                  "CONTEXT": "REQ_ACTION",
                  "DATIME": "2022-09-27T08:00:00+02:00",
                  "DECONT": 0,
                  "TRIAGERED": 0,
                  "TRIAGEYELLOW": 1,
                  "TRIAGEGREEN": 0,
                  "TRIAGEBLACK": 0,
                  "MISSING": 0
                }
              ],
              "EVAC": [
                {
                  "DATIME": "2022-09-27T10:00:00+02:00",
                  "DISPLACED": 0,
                  "EVACUATED": 1
                }
              ],
              "EGEO": [
                {
                  "DATIME": "2022-09-27T08:26:00+02:00",
                  "TYPE": "FLAME",
                  "WEATHER": [
                    "/HUM/RAIN"
                  ],
                  "FREETEXT": "Un peu de pluie vers 8h",
                  "POSITION": {
                    "LOC_ID": "111fb03a-6fd9-41e0-8e81-990c45188887",
                    "NAME": "Lyc\u00e9e Pierre de Coubertin",
                    "TYPE": "POINT",
                    "HEIGHT_ROLE": "MIN",
                    "COORDSYS": "EPSG-4326",
                    "COORD": [
                      {
                        "LAT": 47.221866,
                        "LONG": -1.575807,
                        "HEIGHT": 1
                      }
                    ],
                    "ADDRESS": [
                      "Nantes centre ville"
                    ]
                  }
                }
              ],
              "CAUSE": "ACC",
              "FREETEXT": "Maison sur le c\u00f4t\u00e9 droit de la route"
            },
            "MISSION": [
              {
                "TYPE": "/SAV/ASC",
                "FREETEXT": "Besoin d'un grand v\u00e9hicule car patients \u00e0 prendre en charge volumineux. Ne pas utiliser les gyrophares en approche",
                "ID": "ABC1YU3454",
                "ORG_ID": "sis44",
                "NAME": "#DEMANDE_CONCOURS#CARENCE#Z.01.00.00#",
                "STATUS": "IPR",
                "START_TIME": "2022-09-27T08:21:00+02:00",
                "END_TIME": "2022-09-27T10:21:00+02:00",
                "RESOURCE_ID": [
                  "Non trait\u00e9"
                ],
                "PARENT_MISSION_ID": [
                  "Non trait\u00e9"
                ],
                "CHILD_MISSION_ID": [
                  "Non trait\u00e9"
                ],
                "MAIN_MISSION_ID": "Non trait\u00e9",
                "POSITION": {
                  "LOC_ID": "abcd-hg6T-HSG5-67AA",
                  "NAME": "Lyc\u00e9e Pierre de Coubertin",
                  "TYPE": "POINT",
                  "HEIGHT_ROLE": "MIN",
                  "COORDSYS": "EPSG-4326",
                  "COORD": [
                    {
                      "LAT": 47.221866,
                      "LONG": -1.575807,
                      "HEIGHT": 1
                    }
                  ],
                  "ADDRESS": [
                    "None"
                  ]
                },
                "PRIORITY": "4"
              }
            ]
          }
        }
      }
    }
  ]
}